[Port5]  :  USB-EPP/I2C... CH341A


Is Port User Connectable:         yes
Is Port Debug Capable:            no
Companion Port Number:            0
Companion Hub Symbolic Link Name: 
Protocols Supported:
 USB 1.1:                         yes
 USB 2.0:                         yes
 USB 3.0:                         no

Device Power State:               PowerDeviceD0

       ---===>Device Information<===---
English product name: "USB UART-LPT"

ConnectionStatus:                  
Current Config Value:              0x01  -> Device Bus Speed: Full (is not SuperSpeed or higher capable)
Device Address:                    0x07
Open Pipes:                           3

          ===>Device Descriptor<===
bLength:                           0x12
bDescriptorType:                   0x01
bcdUSB:                          0x0110
bDeviceClass:                      0xFF  -> This is a Vendor Specific Device
bDeviceSubClass:                   0x00
bDeviceProtocol:                   0x02
bMaxPacketSize0:                   0x08 = (8) Bytes
idVendor:                        0x1A86 = Nanjing Qinherg Electronics Co., Ltd.
idProduct:                       0x5512
bcdDevice:                       0x0304
iManufacturer:                     0x00
iProduct:                          0x02
     English (United States)  "USB UART-LPT"
iSerialNumber:                     0x00
bNumConfigurations:                0x01

          ---===>Open Pipes<===---

          ===>Endpoint Descriptor<===
bLength:                           0x07
bDescriptorType:                   0x05
bEndpointAddress:                  0x82  -> Direction: IN - EndpointID: 2
bmAttributes:                      0x02  -> Bulk Transfer Type
wMaxPacketSize:                  0x0020 = 0x20 bytes
bInterval:                         0x00

          ===>Endpoint Descriptor<===
bLength:                           0x07
bDescriptorType:                   0x05
bEndpointAddress:                  0x02  -> Direction: OUT - EndpointID: 2
bmAttributes:                      0x02  -> Bulk Transfer Type
wMaxPacketSize:                  0x0020 = 0x20 bytes
bInterval:                         0x00

          ===>Endpoint Descriptor<===
bLength:                           0x07
bDescriptorType:                   0x05
bEndpointAddress:                  0x81  -> Direction: IN - EndpointID: 1
bmAttributes:                      0x03  -> Interrupt Transfer Type
wMaxPacketSize:                  0x0008 = 0x08 bytes
bInterval:                         0x01

       ---===>Full Configuration Descriptor<===---

          ===>Configuration Descriptor<===
bLength:                           0x09
bDescriptorType:                   0x02
wTotalLength:                    0x0027  -> Validated
bNumInterfaces:                    0x01
bConfigurationValue:               0x01
iConfiguration:                    0x00
bmAttributes:                      0x80  -> Bus Powered
MaxPower:                          0x32 = 100 mA

          ===>Interface Descriptor<===
bLength:                           0x09
bDescriptorType:                   0x04
bInterfaceNumber:                  0x00
bAlternateSetting:                 0x00
bNumEndpoints:                     0x03
bInterfaceClass:                   0xFF  -> Interface Class Unknown to USBView
bInterfaceSubClass:                0x01
bInterfaceProtocol:                0x02
iInterface:                        0x00

          ===>Endpoint Descriptor<===
bLength:                           0x07
bDescriptorType:                   0x05
bEndpointAddress:                  0x82  -> Direction: IN - EndpointID: 2
bmAttributes:                      0x02  -> Bulk Transfer Type
wMaxPacketSize:                  0x0020 = 0x20 bytes
bInterval:                         0x00

          ===>Endpoint Descriptor<===
bLength:                           0x07
bDescriptorType:                   0x05
bEndpointAddress:                  0x02  -> Direction: OUT - EndpointID: 2
bmAttributes:                      0x02  -> Bulk Transfer Type
wMaxPacketSize:                  0x0020 = 0x20 bytes
bInterval:                         0x00

          ===>Endpoint Descriptor<===
bLength:                           0x07
bDescriptorType:                   0x05
bEndpointAddress:                  0x81  -> Direction: IN - EndpointID: 1
bmAttributes:                      0x03  -> Interrupt Transfer Type
wMaxPacketSize:                  0x0008 = 0x08 bytes
bInterval:                         0x01